{
  "schema_version": "2.0",
  "meta": {
    "titel": "Die Eisenzeit – Vom neuen Metall zu den ersten Hochkulturen Mitteleuropas",
    "fach": "Geschichte",
    "stufe": "Gymnasium (Sek II)",
    "dauer": "4-5 Lektionen",
    "titelseite": {
      "zeilen": [
        "Salz, Eisen und die ersten Städte nördlich der Alpen",
        "Von der Hallstatt-Kultur zu den keltischen Oppida",
        "Wie Technologie und Handel Europa prägten (ca. 1200–15 v. Chr.)"
      ]
    }
  },
  "lernziele": {
    "kognitiv": [
      "Ich kann die Bedeutung der Eisenverarbeitung erklären und ihre Auswirkungen auf Landwirtschaft, Handwerk und Machtstrukturen darstellen.",
      "Ich kann die soziale und politische Organisation eisenzeitlicher Gesellschaften (z.B. Siedlungsformen, Hierarchien, Fürstensitze) beschreiben.",
      "Ich kann die Rolle der Kelten in der Eisenzeit charakterisieren und ihre Bedeutung für die europäische Kulturgeschichte einordnen.",
      "Ich kann zentrale Gemeinsamkeiten und Unterschiede zwischen Hallstatt- und La-Tène-Kultur sowie zwischen Bronze- und Eisenzeit herausarbeiten.",
      "Ich kann die Kurgan-Hypothese zur Herkunft der Indogermanen und die sie stützenden Belege (Sprache, Archäologie, Genetik) erläutern."
    ],
    "fertigkeiten": [
      "Ich kann archäologische Quellen der Eisenzeit (z.B. Grabhügel, Waffenfunde, Kunstobjekte, Münzen) interpretieren und ihre Aussagekraft beurteilen.",
      "Ich kann den wirtschaftlichen und kulturellen Austausch eisenzeitlicher Gruppen in Europa anhand konkreter Beispiele (Salzhandel, Weinimport aus Massalia, Fernhandelsgüter) erklären.",
      "Ich kann erklären, wie technische Innovationen (Eisengewinnung, Schmiedetechniken, Pflugschar, Sense, Drehmühle) langfristige soziale und ökonomische Veränderungen auslösten.",
      "Ich kann antike Schriftquellen (griechische und römische Autoren) und archäologische Befunde miteinander verknüpfen und ihre jeweilige Zuverlässigkeit kritisch abwägen."
    ],
    "metakognitiv": [
      "Ich kann einschätzen, wo die Grenzen unseres Wissens über eine schriftlose Vorgeschichte liegen und warum manche Fragen (z.B. Ursachen der keltischen Wanderungen) offen bleiben.",
      "Ich kann konkurrierende wissenschaftliche Hypothesen (z.B. Kurgan- versus Anatolien-These) gegenüberstellen und begründen, warum eine Synthese sinnvoll sein kann.",
      "Ich kann reflektieren, wie technologischer Fortschritt, Handel und ökologische Folgen (z.B. Abholzung) auch für Gegenwartsfragen bedeutsam bleiben."
    ]
  },
  "lehrerhinweis": {
    "text": "## Didaktische Verortung\n\nDie Einheit führt die Lernenden von einer technikgeschichtlichen Innovation (Eisenmetallurgie) zu deren weitreichenden gesellschaftlichen, wirtschaftlichen und kulturellen Folgen. Dieses Vorgehen entspricht dem Prinzip des **exemplarischen Lernens**: Am Fallbeispiel Eisen lässt sich zeigen, wie technologischer Fortschritt Machtstrukturen, Handelsnetze und Siedlungsformen umformt – eine Denkfigur, die bis in Gegenwartsfragen (Ressourcenverbrauch, Abholzung, Globalisierung von Handel) trägt.\n\nBesonders ertragreich ist die Einheit für die **historische Methodenkompetenz**: Erstmals in der mitteleuropäischen Vorgeschichte treffen archäologische Befunde (Hallstatt-Gräber, La-Tène-Funde, Oppida) auf antike Schriftquellen (Hekataios, Herodot, Caesar). Damit lässt sich die Quellenkritik konkret einüben – etwa die kritische Distanz zu Fremdzuschreibungen wie dem 'keltischen Furor'.\n\nDer Exkurs zu den Indogermanen eignet sich hervorragend für die Förderung **metakognitiver Kompetenzen**: Die Gegenüberstellung von Kurgan- und Anatolien-Hypothese und die Einbeziehung von Sprache, Archäologie und Genetik zeigen, wie wissenschaftliche Erkenntnis interdisziplinär entsteht und wo ihre Grenzen liegen. Empfehlenswert ist, offen zu halten, dass viele Fragen (Ursachen der keltischen Wanderungen, Funktion der Viereckschanzen, Charakter der Oppida) bewusst unbeantwortet bleiben – dies ist kein Defizit, sondern Kern historischen Arbeitens über schriftlose Epochen.\n\nDer regionale Bezug (Zürich, Genf, Lausanne als keltische Gründungen; La Tène am Neuenburgersee; Funde aus dem Tessin, aus Bern und Grächwil) bietet Anknüpfungspunkte für die Identifikation der Lernenden und lässt sich für exkursionsartige oder projektorientierte Vertiefungen nutzen.",
    "kernpunkte": [
      "Technikgeschichte als Ausgangspunkt: Eisen als Motor sozialer, ökonomischer und ökologischer Veränderungen",
      "Quellenkritik einüben durch Verknüpfung archäologischer Befunde und antiker Schriftquellen (Fremdzuschreibung beachten)",
      "Indogermanen-Exkurs als Anlass für Reflexion über konkurrierende Hypothesen und interdisziplinäre Evidenz (Sprache, Archäologie, Genetik)",
      "Offen bleibende Fragen bewusst thematisieren als Wesensmerkmal der Vorgeschichtsforschung",
      "Regionalen Schweizer Bezug (Oppida, La Tène, lokale Funde) zur Motivation und Vertiefung nutzen",
      "Gegenwartsrelevanz herausarbeiten: Ressourcenverbrauch, Abholzung, Handel und Innovation"
    ]
  },
  "vorwissen": {
    "text": "## Woran du anknüpfen kannst\n\nBevor wir in die Eisenzeit eintauchen, lohnt es sich, einige bereits bekannte Zusammenhänge zu vergegenwärtigen:\n\n- **Bronzezeit:** Du weisst, dass Bronze eine Legierung aus Kupfer und Zinn ist und dass diese beiden Rohstoffe oft aus weit entfernten Regionen beschafft werden mussten. Halte diesen Punkt fest – er erklärt, warum Eisen später so attraktiv wurde.\n- **Neolithische Revolution:** Ackerbau, Viehhaltung und die Entstehung von Vorräten und Besitz sind dir vertraut. In der Eisenzeit erlebt die Landwirtschaft mit Pflugschar, Sense und Drehmühle einen weiteren Innovationsschub.\n- **Antike Hochkulturen:** Griechische Kolonien (etwa Massalia/Marseille) und das expandierende Römische Reich kennst du bereits. Sie sind die Handelspartner und späteren Gegner der Kelten.\n- **Quellenarten:** Du unterscheidest zwischen materiellen (archäologischen) und schriftlichen Quellen. In dieser Einheit treffen beide erstmals nördlich der Alpen aufeinander.\n\n**Leitgedanke zum Mitnehmen:** Eine einzige technische Neuerung – die Fähigkeit, Eisen zu gewinnen – zieht eine Kette von Veränderungen nach sich: in der Landwirtschaft, im Handel, in der Kriegsführung, in den Machtverhältnissen und sogar in der Umwelt. Achte beim Lesen darauf, wie diese Bereiche zusammenhängen."
  },
  "einleitung": {
    "text": "## Eine Welt ohne Stahl\n\nStell dir ein Leben ohne Messer, Werkzeuge, Nägel oder Schrauben aus Metall vor. So ging es den Menschen vor rund 3000 Jahren – bis sie lernten, **Eisen** zu gewinnen und zu verarbeiten. Dieses Metall war härter, elastischer und vor allem viel leichter zu beschaffen als Bronze, denn Eisenerz findet sich vielerorts direkt unter der Erdoberfläche. Mit Eisen liessen sich schärfere Schwerter, stabilere Pflüge und bessere Werkzeuge herstellen.\n\nDiese technologische Revolution markiert den Beginn der **Eisenzeit**, die in Mitteleuropa etwa von 800 v. Chr. bis zur Zeitenwende dauerte. Sie ist weit mehr als eine archäologische Epoche mit interessanten Funden: In dieser Zeit entstanden die ersten stadtähnlichen Siedlungen nördlich der Alpen – die **Oppida**. Manche von ihnen existieren bis heute: Zürich, Genf und Lausanne gehen auf keltische Gründungen zurück.\n\nBesonders spannend ist diese Epoche, weil wir zum ersten Mal nördlich der Alpen auf eine Kultur treffen, über die nicht nur Archäologen, sondern auch **antike Schriftsteller** berichten. Griechische und römische Autoren hinterliessen faszinierende – wenn auch nicht immer zuverlässige – Beschreibungen der Kelten. Zusammen mit den archäologischen Funden ergibt sich so ein lebendiges Bild einer Kultur, die Europa nachhaltig prägte.\n\nWir unternehmen eine Zeitreise von der ersten Eisenschmelze über die salzreichen Fürstensitze der Hallstatt-Kultur und die geheimnisvolle Herkunft der Indogermanen bis zu den keltischen Oppida und ihrem Untergang unter dem Druck von Germanen und Römern. Dabei zeigt sich immer wieder, wie technologischer Fortschritt, Handel und kultureller Austausch Gesellschaften formen – Fragen, die bis heute hochaktuell sind."
  },
  "haupttext": [
    {
      "typ": "text",
      "text": "## Die Revolution des Eisens (1200–800 v. Chr.)\n\nUm 1200 v. Chr. vollzog sich in Kleinasien und Ägypten eine technologische Revolution, deren Auswirkungen die Entwicklung Europas nachhaltig prägen sollten: Die **Eisenmetallurgie** begann, die jahrtausendealte Bronze-Technologie abzulösen. Über weitreichende Handelsnetzwerke gelangte das Wissen um die Eisenverarbeitung rasch nach Europa und leitete dort eine neue Epoche ein – die Eisenzeit.\n\nDie Vorteile des neuen Materials lagen auf der Hand: Eisen ist härter als Bronze und ermöglichte schärfere Klingen sowie widerstandsfähigere Werkzeuge. Zugleich erwies sich das Metall als elastischer und damit weniger bruchanfällig als die Kupfer-Zinn-Legierung. Der entscheidende ökonomische Vorteil lag jedoch in der **Verfügbarkeit des Rohstoffs**: Während für Bronze zwei verschiedene, oft weit entfernte Erzvorkommen – Kupfer und Zinn – erschlossen werden mussten, fand sich Eisenerz an vielen Orten direkt unter der Erdoberfläche."
    },
    {
      "typ": "tabelle",
      "beschriftung": "Bronze und Eisen im Vergleich",
      "kopf": [
        "Kriterium",
        "Bronze",
        "Eisen"
      ],
      "zeilen": [
        [
          "Härte",
          "weicher",
          "härter"
        ],
        [
          "Elastizität",
          "bruchanfälliger",
          "elastischer, weniger bruchanfällig"
        ],
        [
          "Rohstoffe",
          "zwei oft weit entfernte Erze (Kupfer + Zinn)",
          "ein Erz, vielerorts oberflächennah"
        ],
        [
          "Verwendung zu Beginn der Eisenzeit",
          "weiterhin Schmuck und Gefässe",
          "zunehmend Waffen, Werkzeuge, Wagenräder"
        ]
      ]
    },
    {